{
  "id": "district-citizen-quinn",
  "name": "Habitante de la Capitale",
  "source": "original",
  "status": {
    "provisoire": true,
    "raison": "Population ambiante animée : corps et clips du créateur humanoid existant. La garde-robe civile et les têtes MetaHuman ne sont pas encore disponibles sur le poste.",
    "retraitSi": "Remplacement par la production finale des habitants des LOT-114 et LOT-115."
  },
  "creator": "humanoid",
  "body": "quinn",
  "head": "quinn",
  "height": 1.7,
  "colors": {},
  "pieces": {},
  "weapons": {}
}
