{
  "id": "heros-priest",
  "name": "Helga Pierre-Sûre",
  "source": "tanares",
  "status": {
    "provisoire": true,
    "raison": "LOT-1015 : premiere apparence ecrite par l'assistant, sans que l'auteur l'ait vue ; les valeurs (taille, couleurs, pieces) sont des choix de depart.",
    "retraitSi": "l'auteur juge les captures de controle a la recette du lot et fixe les valeurs"
  },
  "creator": "humanoid",
  "clips": {
    "attack": {
      "key": 0.4
    },
    "cast": {
      "key": 0.5
    }
  },
  "body": "metahuman",
  "head": "metahuman",
  "height": 1.45,
  "colors": {
    "skin": [
      0.75,
      0.6,
      0.5
    ],
    "hair": [
      0.55,
      0.3,
      0.1
    ],
    "eyes": [
      0.3,
      0.3,
      0.5
    ]
  },
  "pieces": {
    "torso": "none",
    "legs": "none",
    "feet": "none",
    "hair": "none"
  },
  "weapons": {
    "main-hand": "Weapons/priest-warhammer",
    "off-hand": "Weapons/ironhand-shield"
  },
  "metahuman": {
    "bodyConstraints": {
      "height": 145.0
    },
    "skin": {
      "u": 0.3,
      "v": 0.4,
      "roughness": 0.75
    }
  }
}
