{
  "id": "heros-mage",
  "name": "Faelar Trace-Carte",
  "source": "tanares",
  "status": {
    "provisoire": true,
    "raison": "LOT-1015 : premiere apparence ecrite par l'assistant, sans que l'auteur l'ait vue ; le corps est le mannequin du moteur tant que le contenu optionnel de MetaHuman Creator n'est pas installe sur le poste (le bloc metahuman attend) ; taille, couleurs, pieces sont des choix de depart.",
    "retraitSi": "l'auteur juge les captures de controle a la recette du lot et fixe les valeurs"
  },
  "creator": "humanoid",
  "clips": {
    "attack": {
      "key": 0.4
    },
    "cast": {
      "key": 0.5
    }
  },
  "body": "manny",
  "head": "manny",
  "height": 1.8,
  "colors": {
    "skin": [
      0.8,
      0.65,
      0.55
    ],
    "hair": [
      0.6,
      0.25,
      0.08
    ],
    "eyes": [
      0.2,
      0.5,
      0.3
    ]
  },
  "pieces": {
    "torso": "none",
    "legs": "none",
    "feet": "none",
    "hair": "none"
  },
  "weapons": {
    "main-hand": "Weapons/mage-staff"
  },
  "metahuman": {
    "bodyConstraints": {
      "height": 180.0
    },
    "skin": {
      "u": 0.25,
      "v": 0.35,
      "roughness": 0.7
    }
  }
}
